{
  "vsphere_server": "vcenter.contoso.local",
  "allow_unverified_ssl": false,
  "datacenter": "Datacenter",
  "cluster": "Cluster",
  "folder": "vm/dev",
  "vms": [
    {
      "name": "tf-web",
      "num_cpus": 2,
      "memory": 4096,
      "disk_size": 50,
      "datastore": "datastore1",
      "network": "VM Network",
      "guest_id": "windows2019srvNext_64Guest",
      "iso_path": "iso/en_windows_server_2022_x64.iso",
      "iso_datastore": "datastore1",
      "firmware": "efi"
    }
  ]
}
