{
  "vsphere_server": "vcenter.contoso.local",
  "allow_unverified_ssl": true,
  "datacenter": "Datacenter",
  "cluster": "Cluster",
  "folder": "vm/dev",
  "vms": [
    {
      "name": "tf-web-01",
      "num_cpus": 2,
      "memory": 4096,
      "disk_size": 50,
      "datastore": "datastore1",
      "network": "VM Network",
      "guest_id": "windows2019Server64Guest",
      "iso_path": "[datastore1] ISOs/en_windows_server_2022.iso",
      "firmware": "efi"
    }
  ]
}
